{
  "$schema": "http://json-schema.org/draft-04/schema#",
  "title": "Retrieve a Foreign Property Income & Expenditure Period Summary",
  "description": "Retrieve a Foreign Property Income & Expenditure Period Summary",
  "type": "object",
  "properties": {
    "submittedOn": {
      "description": "The date the foreign property were submitted, in the format YYYY-MM-DDThh:mm:ss.SSSZ",
      "type": "string",
      "example": "2021-06-17T10:59:47.544Z"
    },
    "fromDate": {
      "description": "The first day that the income and expenses period summary covers. Must conform to the format YYYY-MM-DD",
      "type": "string",
      "example": "2020-01-01"
    },
    "toDate": {
      "description": "The last day that the income and expenses period summary covers. Must conform to the format YYYY-MM-DD",
      "type": "string",
      "example": "2020-01-31"
    },
    "foreignFhlEea": {
      "type": "object",
      "description": "Object holding the income and expenses of the user's Furnished Holiday Lettings (FHL) in the European Economic Area (EEA) for the period.",
      "properties": {
        "income": {
          "type": "object",
          "description": "Object holding the income details for the period.",
          "properties": {
            "rentAmount": {
              "type": "number",
              "description": "Total rent and other income from property.\n\nThe value must be between 0 and 99999999999.99 up to 2 decimal places.",
              "example": "5000.99"
            }
          },
          "additionalProperties": false
        },
        "expenses": {
          "type": "object",
          "description": "Object holding the expenses for the period.",
          "properties": {
            "premisesRunningCosts": {
              "type": "number",
              "description": "Rent, rates, insurance, ground rents and other costs.\nThe value must be between 0 and 99999999999.99 up to 2 decimal places.",
              "example": "5000.99"
            },
            "repairsAndMaintenance": {
              "type": "number",
              "description": "Rent, rates, insurance, ground rents and other costs.\nThe value must be between 0 and 99999999999.99 up to 2 decimal places.",
              "example": "5000.99"
            },
            "financialCosts": {
              "type": "number",
              "description": "Loan interest and other financial costs.\nThe value must be between 0 and 99999999999.99 up to 2 decimal places.",
              "example": "5000.99"
            },
            "professionalFees": {
              "type": "number",
              "description": "Legal, management and other professional fees.\nThe value must be between 0 and 99999999999.99 up to 2 decimal places.",
              "example": "5000.99"
            },
            "costOfServices": {
              "type": "number",
              "description": "Cost of services provided, including wages.\nThe value must be between 0 and 99999999999.99 up to 2 decimal places.",
              "example": "5000.99"
            },
            "travelCosts": {
              "type": "number",
              "description": "Car, van and travel costs incurred in running a property business.\nThe value must be between 0 and 99999999999.99 up to 2 decimal places.",
              "example": "5000.99"
            },
            "other": {
              "type": "number",
              "description": "Other allowable property expenses.\nThe value must be between 0 and 99999999999.99 up to 2 decimal places.",
              "example": "5000.99"
            },
            "consolidatedExpenses": {
              "type": "number",
              "description": "The sum of all expenses for the specified period. You can either submit a consolidatedExpenses value or individual expenses (premisesRunningCosts, repairsAndMaintenance, financialCosts, professionalFees, costOfServices, travelCosts, other).\nThe value must be between 0 and 99999999999.99 up to 2 decimal places.",
              "example": "5000.99"
            }
          },
          "additionalProperties": false
        }
      },
      "additionalProperties": false
    },
    "foreignNonFhlProperty": {
      "type": "array",
      "description": "Array holding the income and expenses of the user's foreign property business - excluding Furnished Holiday Lettings (FHL) in the European Economic Area (EEA) - for the period.",
      "items": {
        "type": "object",
        "properties": {
          "countryCode": {
            "type": "string",
            "description": "A three-letter code that represents a country name.\n\nThis must be an ISO 3166-1 Alpha-3 value.",
            "example": "FRA"
          },
          "income": {
            "type": "object",
            "description": "Object holding the income details for the period.",
            "properties": {
              "rentIncome": {
                "type": "object",
                "description": "Object holding the rent income.",
                "properties": {
                  "rentAmount": {
                    "type": "number",
                    "description": "Total rent and other income from property.\nThe value must be between 0 and 99999999999.99 up to 2 decimal places.",
                    "example": "5000.99"
                  }
                },
                "additionalProperties": false
              },
              "foreignTaxCreditRelief": {
                "type": "boolean",
                "description": "A boolean indicating whether Foreign Tax Credit Relief (FTCR) has been claimed.",
                "example": "false"
              },
              "premiumsOfLeaseGrant": {
                "type": "number",
                "description": "Premiums received for the grant of a lease and other lump sums to possess a property.\n\nThe value must be between 0 and 99999999999.99 up to 2 decimal places.",
                "example": "5000.99"
              },
              "otherPropertyIncome": {
                "type": "number",
                "description": "Other income from property, such as rent charges and ground rents, income from letting others tip waste on your land, and income for the use of a caravan or houseboat at a fixed location.\nThe value must be between 0 and 99999999999.99 up to 2 decimal places.",
                "example": "5000.99"
              },
              "foreignTaxPaidOrDeducted": {
                "type": "number",
                "description": "The total amount of foreign tax paid or deducted from your income.\n\nThe value must be between 0 and 99999999999.99 up to 2 decimal places.",
                "example": "5000.99"
              },
              "specialWithholdingTaxOrUkTaxPaid": {
                "type": "number",
                "description": "Tax withheld (in UK Pounds) on certain payments to UK residents or UK Tax paid from rental Income (applies to non-resident landlords only).\n\nThe value must be between 0 and 99999999999.99 up to 2 decimal places.",
                "example": "5000.99"
              }
            },
            "required": [
              "foreignTaxCreditRelief"
            ],
            "additionalProperties": false
          },
          "expenses": {
            "type": "object",
            "description": "Object holding the expenses for the period.",
            "properties": {
              "premisesRunningCosts": {
                "type": "number",
                "description": "Rent, rates, insurance, ground rents and other costs.\nThe value must be between 0 and 99999999999.99 up to 2 decimal places.",
                "example": "5000.99"
              },
              "repairsAndMaintenance": {
                "type": "number",
                "description": "Property repairs and maintenance.\nThe value must be between 0 and 99999999999.99 up to 2 decimal places.",
                "example": "5000.99"
              },
              "financialCosts": {
                "type": "number",
                "description": "Loan interest and other financial costs.\nThe value must be between 0 and 99999999999.99 up to 2 decimal places.",
                "example": "5000.99"
              },
              "professionalFees": {
                "type": "number",
                "description": "Legal, management and other professional fees.\nThe value must be between 0 and 99999999999.99 up to 2 decimal places.",
                "example": "5000.99"
              },
              "costOfServices": {
                "type": "number",
                "description": "Cost of services provided, including wages.\nThe value must be between 0 and 99999999999.99 up to 2 decimal places.",
                "example": "5000.99"
              },
              "travelCosts": {
                "type": "number",
                "description": "Car, van and travel costs incurred in running a property business.\nThe value must be between 0 and 99999999999.99 up to 2 decimal places.",
                "example": "5000.99"
              },
              "residentialFinancialCost": {
                "type": "number",
                "description": "The residential financial cost deductible from rental income (tax relief).\n\nThe value must be between 0 and 99999999999.99 up to 2 decimal places.",
                "example": "5000.99"
              },
              "broughtFwdResidentialFinancialCost": {
                "type": "number",
                "description": "Amount of relief brought forward for restricted residential financial costs.\nThe value must be between 0 and 99999999999.99 up to 2 decimal places.",
                "example": "5000.99"
              },
              "other": {
                "type": "number",
                "description": "Other allowable property expenses.\nThe value must be between 0 and 99999999999.99 up to 2 decimal places.",
                "example": "5000.99"
              },
              "consolidatedExpenses": {
                "type": "number",
                "description": "The sum of all expenses for the specified period. You can either submit a consolidatedExpenses value or individual expenses (premisesRunningCosts, repairsAndMaintenance, financialCosts, professionalFees, costOfServices, travelCosts, other).\nThe value must be between 0 and 99999999999.99 up to 2 decimal places.",
                "example": "5000.99"
              }
            },
            "additionalProperties": false
          }
        },
        "required": [
          "countryCode"
        ],
        "additionalProperties": false
      }
    },
    "links": {
      "type": "array",
      "items": {
        "type": "object",
        "description": "A list of endpoint links that indicate possible actions related to the current resource.",
        "properties": {
          "href": {
            "description": "The relative url of the endpoint.",
            "type": "string",
            "example": "/individuals/business/property/foreign/CX897463D/XAIS12345678910/period/2021-22/4557ecb5-fd32-48cc-81f5-e6acd1099f3c"
          },
          "method": {
            "description": "The HTTP method type for the endpoint.",
            "type": "string",
            "enum": [
              "GET",
              "PUT"
            ]
          },
          "rel": {
            "description": "A label for the endpoint, which describes how it is related to the current resource\nThe rel will be self where the action is retrieval of the same resource.",
            "type": "string",
            "enum": [
              "self",
              "amend-foreign-property-period-summary",
              "list-property-period-summaries"
            ]
          }
        },
        "required": [
          "href",
          "method",
          "rel"
        ],
        "additionalProperties": false
      }
    }
  },
  "required": [
    "submittedOn",
    "fromDate",
    "toDate"
  ],
  "additionalProperties": false
}