{
  "submittedOn": "2021-06-17T10:59:47.544Z",
  "fromDate": "2020-01-01",
  "toDate": "2020-01-31",
  "foreignFhlEea": {
    "income": {
      "rentAmount": 200.22
    },
    "expenses": {
      "premisesRunningCosts": 100.25,
      "repairsAndMaintenance": 100.25,
      "financialCosts": 100.25,
      "professionalFees": 100.25,
      "costOfServices": 100.25,
      "travelCosts": 100.25,
      "other": 100.25
    }
  },
  "foreignNonFhlProperty": [
    {
      "countryCode": "FRA",
      "income": {
        "rentIncome": {
          "rentAmount": 200.22
        },
        "foreignTaxCreditRelief": true,
        "premiumsOfLeaseGrant": 100.25,
        "otherPropertyIncome": 100.25,
        "foreignTaxPaidOrDeducted": 44.21,
        "specialWithholdingTaxOrUkTaxPaid": 23.78
      },
      "expenses": {
        "premisesRunningCosts": 100.25,
        "repairsAndMaintenance": 100.25,
        "financialCosts": 200.25,
        "professionalFees": 100.25,
        "costOfServices": 100.25,
        "travelCosts": 100.25,
        "residentialFinancialCost": 100.25,
        "broughtFwdResidentialFinancialCost": 100.25,
        "other": 100.25
      }
    }
  ],
  "links": [
    {
      "href": "/individuals/business/property/foreign/CX897463D/XAIS12345678910/period/2021-22/4557ecb5-fd32-48cc-81f5-e6acd1099f3c",
      "method": "PUT",
      "rel": "amend-foreign-property-period-summary"
    },
    {
      "href": "/individuals/business/property/foreign/CX897463D/XAIS12345678910/period/2021-22/4557ecb5-fd32-48cc-81f5-e6acd1099f3c",
      "method": "GET",
      "rel": "self"
    },
    {
      "href": "/individuals/business/property/CX897463D/XAIS12345678910/period/2021-22",
      "method": "GET",
      "rel": "list-property-period-summaries"
    }
  ]
}